{
  "schema_version": 1,
  "engine": {
    "name": "@deckflow/deckhtml",
    "version": "0.6.1"
  },
  "status": "succeeded",
  "slides": [
    {
      "slide_id": "slide-01",
      "index": 1,
      "elements": [
        {
          "element_id": null,
          "kind": "canvas",
          "mapping_mode": "raster",
          "object_ref": null,
          "geometry": {
            "x": 0,
            "y": 0,
            "w": 10,
            "h": 5.625,
            "unit": "inch"
          },
          "warnings": []
        },
        {
          "element_id": null,
          "kind": "shape",
          "mapping_mode": "native",
          "object_ref": null,
          "geometry": {
            "x": 0,
            "y": 0,
            "w": 10,
            "h": 5.625,
            "unit": "inch"
          },
          "warnings": []
        },
        {
          "element_id": null,
          "kind": "shape",
          "mapping_mode": "native",
          "object_ref": null,
          "geometry": {
            "x": 0,
            "y": 0,
            "w": 10,
            "h": 5.625,
            "unit": "inch"
          },
          "warnings": []
        },
        {
          "element_id": null,
          "kind": "shape",
          "mapping_mode": "native",
          "object_ref": null,
          "geometry": {
            "x": 4.5,
            "y": 0.0625,
            "w": 5.5,
            "h": 5.5625,
            "unit": "inch"
          },
          "warnings": []
        },
        {
          "element_id": null,
          "kind": "shape",
          "mapping_mode": "native",
          "object_ref": null,
          "geometry": {
            "x": 4.9375,
            "y": 0.5625,
            "w": 1.40869140625,
            "h": 1.0390625,
            "unit": "inch"
          },
          "warnings": []
        },
        {
          "element_id": null,
          "kind": "shape",
          "mapping_mode": "native",
          "object_ref": null,
          "geometry": {
            "x": 4.9375,
            "y": 0.5625,
            "w": 1.40869140625,
            "h": 1.0390625,
            "unit": "inch"
          },
          "warnings": []
        },
        {
          "element_id": null,
          "kind": "text",
          "mapping_mode": "native",
          "object_ref": null,
          "geometry": {
            "x": 5.1015625,
            "y": 0.7578125,
            "w": 1.08056640625,
            "h": 0.4375,
            "unit": "inch"
          },
          "warnings": []
        },
        {
          "element_id": null,
          "kind": "text",
          "mapping_mode": "native",
          "object_ref": null,
          "geometry": {
            "x": 5.1015625,
            "y": 1.2578125,
            "w": 1.08056640625,
            "h": 0.125,
            "unit": "inch"
          },
          "warnings": []
        },
        {
          "element_id": null,
          "kind": "shape",
          "mapping_mode": "native",
          "object_ref": null,
          "geometry": {
            "x": 6.53369140625,
            "y": 0.5625,
            "w": 1.40869140625,
            "h": 1.0390625,
            "unit": "inch"
          },
          "warnings": []
        },
        {
          "element_id": null,
          "kind": "shape",
          "mapping_mode": "native",
          "object_ref": null,
          "geometry": {
            "x": 6.53369140625,
            "y": 0.5625,
            "w": 1.40869140625,
            "h": 1.0390625,
            "unit": "inch"
          },
          "warnings": []
        },
        {
          "element_id": null,
          "kind": "text",
          "mapping_mode": "native",
          "object_ref": null,
          "geometry": {
            "x": 6.69775390625,
            "y": 0.7578125,
            "w": 1.08056640625,
            "h": 0.4375,
            "unit": "inch"
          },
          "warnings": []
        },
        {
          "element_id": null,
          "kind": "text",
          "mapping_mode": "native",
          "object_ref": null,
          "geometry": {
            "x": 6.69775390625,
            "y": 1.2578125,
            "w": 1.08056640625,
            "h": 0.125,
            "unit": "inch"
          },
          "warnings": []
        },
        {
          "element_id": null,
          "kind": "shape",
          "mapping_mode": "native",
          "object_ref": null,
          "geometry": {
            "x": 8.1298828125,
            "y": 0.5625,
            "w": 1.4326171875,
            "h": 1.0390625,
            "unit": "inch"
          },
          "warnings": []
        },
        {
          "element_id": null,
          "kind": "shape",
          "mapping_mode": "native",
          "object_ref": null,
          "geometry": {
            "x": 8.1298828125,
            "y": 0.5625,
            "w": 1.4326171875,
            "h": 1.0390625,
            "unit": "inch"
          },
          "warnings": []
        },
        {
          "element_id": null,
          "kind": "text",
          "mapping_mode": "native",
          "object_ref": null,
          "geometry": {
            "x": 8.2939453125,
            "y": 0.7578125,
            "w": 1.1044921875,
            "h": 0.4375,
            "unit": "inch"
          },
          "warnings": []
        },
        {
          "element_id": null,
          "kind": "text",
          "mapping_mode": "native",
          "object_ref": null,
          "geometry": {
            "x": 8.2939453125,
            "y": 1.2578125,
            "w": 1.1044921875,
            "h": 0.125,
            "unit": "inch"
          },
          "warnings": []
        },
        {
          "element_id": null,
          "kind": "shape",
          "mapping_mode": "native",
          "object_ref": null,
          "geometry": {
            "x": 4.9375,
            "y": 1.9765625,
            "w": 4.625,
            "h": 1.1015625,
            "unit": "inch"
          },
          "warnings": []
        },
        {
          "element_id": null,
          "kind": "text",
          "mapping_mode": "native",
          "object_ref": null,
          "geometry": {
            "x": 5.1015625,
            "y": 2.140625,
            "w": 0.375,
            "h": 0.375,
            "unit": "inch"
          },
          "warnings": []
        },
        {
          "element_id": null,
          "kind": "text",
          "mapping_mode": "native",
          "object_ref": null,
          "geometry": {
            "x": 5.1015625,
            "y": 2.140625,
            "w": 0.375,
            "h": 0.375,
            "unit": "inch"
          },
          "warnings": []
        },
        {
          "element_id": null,
          "kind": "text",
          "mapping_mode": "native",
          "object_ref": null,
          "geometry": {
            "x": 5.6328125,
            "y": 2.140625,
            "w": 3.765625,
            "h": 0.1640625,
            "unit": "inch"
          },
          "warnings": []
        },
        {
          "element_id": null,
          "kind": "text",
          "mapping_mode": "native",
          "object_ref": null,
          "geometry": {
            "x": 5.6328125,
            "y": 2.3515625,
            "w": 3.765625,
            "h": 0.5625,
            "unit": "inch"
          },
          "warnings": []
        },
        {
          "element_id": null,
          "kind": "shape",
          "mapping_mode": "native",
          "object_ref": null,
          "geometry": {
            "x": 4.9375,
            "y": 3.265625,
            "w": 4.625,
            "h": 1.1015625,
            "unit": "inch"
          },
          "warnings": []
        },
        {
          "element_id": null,
          "kind": "text",
          "mapping_mode": "native",
          "object_ref": null,
          "geometry": {
            "x": 5.1015625,
            "y": 3.4296875,
            "w": 0.375,
            "h": 0.375,
            "unit": "inch"
          },
          "warnings": []
        },
        {
          "element_id": null,
          "kind": "text",
          "mapping_mode": "native",
          "object_ref": null,
          "geometry": {
            "x": 5.1015625,
            "y": 3.4296875,
            "w": 0.375,
            "h": 0.375,
            "unit": "inch"
          },
          "warnings": []
        },
        {
          "element_id": null,
          "kind": "text",
          "mapping_mode": "native",
          "object_ref": null,
          "geometry": {
            "x": 5.6328125,
            "y": 3.4296875,
            "w": 3.765625,
            "h": 0.1640625,
            "unit": "inch"
          },
          "warnings": []
        },
        {
          "element_id": null,
          "kind": "text",
          "mapping_mode": "native",
          "object_ref": null,
          "geometry": {
            "x": 5.6328125,
            "y": 3.640625,
            "w": 3.765625,
            "h": 0.5625,
            "unit": "inch"
          },
          "warnings": []
        },
        {
          "element_id": null,
          "kind": "shape",
          "mapping_mode": "native",
          "object_ref": null,
          "geometry": {
            "x": 4.9375,
            "y": 4.5546875,
            "w": 4.625,
            "h": 0.9140625,
            "unit": "inch"
          },
          "warnings": []
        },
        {
          "element_id": null,
          "kind": "text",
          "mapping_mode": "native",
          "object_ref": null,
          "geometry": {
            "x": 5.1015625,
            "y": 4.71875,
            "w": 0.375,
            "h": 0.375,
            "unit": "inch"
          },
          "warnings": []
        },
        {
          "element_id": null,
          "kind": "text",
          "mapping_mode": "native",
          "object_ref": null,
          "geometry": {
            "x": 5.1015625,
            "y": 4.71875,
            "w": 0.375,
            "h": 0.375,
            "unit": "inch"